{
  "id": "e4f1a23b-56c7-4d8e-9f0a-1b2c3d4e5f6a",
  "version-dsl": "1.0.0",
  "settings": {
    "id": "789a012b-34c5-4d6e-8f90-a1b2c3d4e5f6",
    "name": "Momentum Alpha + Relative Bear Gold",
    "starting_cash": 100000,
    "start_date": "2019-01-22",
    "end_date": "2025-12-31",
    "rebalance_frequency": "weekly",
    "slippage": 0.0005,
    "fees": 0.0,
    "netting": {
      "pairs": [
        {
          "long_ticker": "QQQ",
          "long_leverage": 1.0,
          "short_ticker": "PSQ",
          "short_leverage": -1.0
        }
      ],
      "cash_ticker": "XCASHX"
    }
  },
  "root_node": {
    "id": "d1c2b3a4-e5f6-4a7b-8c9d-0e1f2a3b4c5d",
    "name": "Relative Volatility Filter",
    "type": "if_else",
    "logic_mode": "all",
    "conditions": [
      {
        "lhs": {
          "asset": "VIXY",
          "function": "current_price"
        },
        "comparator": "greater_than",
        "rhs": {
          "asset": "VIXY",
          "function": "sma_price",
          "lookback": "20d"
        }
      }
    ],
    "true_branch": {
      "id": "b1a2c3d4-e5f6-4a7b-8c9d-0e1f2a3b4c5d",
      "name": "Active Bear + Gold",
      "type": "weight",
      "method": "defined",
      "method_params": {
        "custom_weights": {
          "f1e2d3c4-b5a6-4a7b-8c9d-0e1f2a3b4c5d": 0.6,
          "a1b2c3d4-e5f6-4a7b-8c9d-0e1f2a3b4c5d": 0.2,
          "c1b2a3d4-e5f6-4a7b-8c9d-0e1f2a3b4c5d": 0.2
        }
      },
      "children": [
        {
          "id": "f1e2d3c4-b5a6-4a7b-8c9d-0e1f2a3b4c5d",
          "type": "asset",
          "ticker": "PSQ"
        },
        {
          "id": "a1b2c3d4-e5f6-4a7b-8c9d-0e1f2a3b4c5d",
          "type": "asset",
          "ticker": "QQQ"
        },
        {
          "id": "c1b2a3d4-e5f6-4a7b-8c9d-0e1f2a3b4c5d",
          "type": "asset",
          "ticker": "GLD"
        }
      ]
    },
    "false_branch": {
      "id": "0e1f2a3b-4c5d-6e7f-8a9b-0c1d2e3f4a5b",
      "name": "Risk-On Momentum Selection",
      "type": "filter",
      "sort_by": {
        "function": "cumulative_return",
        "lookback": "20d"
      },
      "select": {
        "mode": "top",
        "count": 1
      },
      "children": [
        {
          "id": "9a8b7c6d-5e4f-3a2b-1c0d-9e8f7a6b5c4d",
          "type": "asset",
          "ticker": "IWM"
        },
        {
          "id": "8a7b6c5d-4e3f-2a1b-0c9d-8e7f6a5b4c3d",
          "type": "asset",
          "ticker": "QQQ"
        },
        {
          "id": "7a6b5c4d-3e2f-1a0b-9c8d-7e6f5a4b3c2d",
          "type": "asset",
          "ticker": "SPY"
        }
      ]
    }
  }
}