{
  "id": "e4f8a2c1-3d9b-4e7a-bc5d-1f2a3b4c5d6e",
  "version-dsl": "1.0.0",
  "settings": {
    "id": "f5a6b7c8-d9e0-4a1b-bc2d-3e4f5a6b7c8d",
    "name": "Global Dual Momentum (SPY/EEM/BIL)",
    "starting_cash": 100000,
    "start_date": "2019-01-22",
    "end_date": "2025-12-31",
    "rebalance_frequency": "monthly",
    "slippage": 0.0005,
    "fees": 0.0,
    "rebalance_threshold": 0.05
  },
  "root_node": {
    "id": "7878696d-352b-456c-8c4d-617374657231",
    "name": "Absolute Momentum Filter",
    "type": "if_else",
    "logic_mode": "all",
    "conditions": [
      {
        "lhs": {
          "asset": "SPY",
          "function": "current_price"
        },
        "comparator": "greater_than",
        "rhs": {
          "asset": "SPY",
          "function": "sma_price",
          "lookback": "200d"
        },
        "duration": "1d"
      }
    ],
    "true_branch": {
      "id": "c9bf9e57-1685-4c89-bafb-ff5af830be8a",
      "name": "Relative Momentum Selector",
      "type": "filter",
      "sort_by": {
        "function": "cumulative_return",
        "lookback": "126d"
      },
      "select": {
        "mode": "top",
        "count": 1
      },
      "children": [
        {
          "id": "3f2e1d0c-9b8a-7f6e-5d4c-1a2b3c4d5e6f",
          "name": "US Equities",
          "type": "asset",
          "ticker": "SPY"
        },
        {
          "id": "a1b2c3d4-e5f6-4a5b-8c9d-0e1f2a3b4c5d",
          "name": "Emerging Markets",
          "type": "asset",
          "ticker": "EEM"
        }
      ]
    },
    "false_branch": {
      "id": "f47ac10b-58cc-4372-a567-0e02b2c3d479",
      "name": "Safety Asset",
      "type": "asset",
      "ticker": "BIL"
    }
  }
}